{
  "schema_version": "v1",
  "profile_id": "share_profile_allow_01",
  "state": "active",
  "created_at": "2026-03-15T00:00:00Z",
  "expires_at": "2026-03-16T00:00:00Z",
  "permissions": {
    "predicted_sleep_window": true,
    "predicted_waking_window": true,
    "confidence": true,
    "availability": false
  }
}
